<?xml version = "1.0" encoding = "UTF-8" standalone = "yes" ?>
<country xmlns:xsi="http://www.w3.org/2001/XMLSchema-instance" xsi:noNamespaceSchemaLocation="country.xsd"
        name="Luxembourg">
     <economics-data>
		 <GDP value="82,274.812251"/>
		 <PPP value="86,117"/>
		 <population value="0.647599"/>
		 <GDP-growth value="1.55"/>
	</economics-data>
	
	<!-- Taken from 
  	  	https://en.wikipedia.org/wiki/List_of_countries_by_median_age
    	https://www.worlddata.info/average-bodyheight.php -->
    <characteristics median-age-male="38.9" median-age-female="40.0" 	
				average-male-height="178" average-female-height="165"
	            average-male-weight="85.2" average-female-weight="69.1"/>
		
    <first-name-list>
        <first-name value="Gabriel" gender="male" />
        <first-name value="Leo" gender="male" />
        <first-name value="Luca" gender="male" />
        <first-name value="Noah" gender="male" />
        <first-name value="David" gender="male" />
        <first-name value="Tom" gender="male" />
        <first-name value="Ben" gender="male" />
        <first-name value="Fränk" gender="male" />
        <first-name value="Andy" gender="male" />
        <first-name value="Teo" gender="male" />

        <first-name value="Emma" gender="female" />
        <first-name value="Lara" gender="female" />
        <first-name value="Zoé" gender="female" />
        <first-name value="Amy" gender="female" />
        <first-name value="Sarah" gender="female" />
        <first-name value="Charlotte" gender="female" />
        <first-name value="Emily" gender="female" />
    </first-name-list>
    <last-name-list>
        <!-- 10 most common Luxembourgish surnames -->

        <last-name value="Hoffmann" />
        <last-name value="Klein" />
        <last-name value="Muller" />
        <last-name value="Reuter" />
        <last-name value="Schmit" />
        <last-name value="Schmitz" />
        <last-name value="Schroeder" />
        <last-name value="Thill" />
        <last-name value="Wagner" />
        <last-name value="Weber" />
    </last-name-list>
</country>